{
  "contractVersion": "1.0.0",
  "package": {
    "id": "01a0132c-4eef-7703-94ac-ec8d1a660001",
    "version": "1.0.2",
    "name": "匕首之心",
    "description": "由迁移后的 Sheet Runtime 驱动的 Daggerheart Core 系统包。"
  },
  "runtime": {
    "characterDataVersion": "1.0.0",
    "loadingPresentation": {
      "tagline": "正在掷二元骰...",
      "accentColor": "#a83a24"
    },
    "pages": "pages.json",
    "shell": {
      "html": "layouts/shell.html",
      "css": "layouts/shell.css"
    },
    "skins": [
      {
        "id": "skin-KimiK3",
        "name": "松烟纸墨",
        "css": "skins/skin-KimiK3/skin.css",
        "frameworkColorScheme": "light",
        "layoutOverrides": {
          "shell": {
            "html": "skins/skin-KimiK3/shell.html"
          },
          "pages": [
            {
              "id": "character-main",
              "html": "skins/skin-KimiK3/character-main.html"
            },
            {
              "id": "character-story",
              "html": "skins/skin-KimiK3/character-story.html"
            }
          ]
        }
      },
      {
        "id": "skin-black-hours",
        "name": "黑时祷书",
        "css": "skins/skin-black-hours/skin.css",
        "frameworkColorScheme": "dark",
        "layoutOverrides": {
          "shell": {
            "html": "skins/skin-black-hours/shell.html"
          },
          "pages": [
            {
              "id": "character-main",
              "html": "skins/skin-black-hours/character-main.html"
            }
          ]
        }
      }
    ],
    "defaultSkin": "skin-KimiK3",
    "modules": "modules.json",
    "dependencies": "dependencies.json",
    "characterCreationGuide": "guides/character-creation.json",
    "questionnaireCharacterCreation": {
      "id": "daggerheart-class-domain-recommendation",
      "name": "职业与领域推荐问卷",
      "html": "questionnaires/class-domain-recommendation.html"
    },
    "characterFormatAdapters": "adapters/character-formats.json",
    "characterTextExports": "exports/character-text.json",
    "validationChecks": [
      {
        "id": "character-consistency",
        "script": "checks/character-consistency.js"
      }
    ]
  },
  "resourceCompatibility": [
    {
      "templateId": "种族",
      "versionRange": {
        "minimumInclusive": "1.0.0",
        "maximumExclusive": "2.0.0"
      },
      "nativeEntry": {
        "id": "ancestries",
        "label": "种族"
      }
    },
    {
      "templateId": "社群",
      "versionRange": {
        "minimumInclusive": "1.0.0",
        "maximumExclusive": "2.0.0"
      },
      "nativeEntry": {
        "id": "communities",
        "label": "社群"
      }
    },
    {
      "templateId": "职业",
      "versionRange": {
        "minimumInclusive": "1.0.0",
        "maximumExclusive": "2.0.0"
      },
      "nativeEntry": {
        "id": "classes",
        "label": "职业"
      }
    },
    {
      "templateId": "子职业",
      "versionRange": {
        "minimumInclusive": "1.0.0",
        "maximumExclusive": "2.0.0"
      },
      "nativeEntry": {
        "id": "subclasses",
        "label": "子职业"
      }
    },
    {
      "templateId": "武器",
      "versionRange": {
        "minimumInclusive": "1.0.0",
        "maximumExclusive": "2.0.0"
      },
      "nativeEntry": {
        "id": "weapons",
        "label": "武器"
      }
    },
    {
      "templateId": "护甲",
      "versionRange": {
        "minimumInclusive": "1.0.0",
        "maximumExclusive": "2.0.0"
      },
      "nativeEntry": {
        "id": "armor",
        "label": "护甲"
      }
    },
    {
      "templateId": "物品",
      "versionRange": {
        "minimumInclusive": "1.0.0",
        "maximumExclusive": "2.0.0"
      },
      "nativeEntry": {
        "id": "loot",
        "label": "物品与消耗品"
      }
    },
    {
      "templateId": "领域卡",
      "versionRange": {
        "minimumInclusive": "1.0.0",
        "maximumExclusive": "2.0.0"
      },
      "nativeEntry": {
        "id": "domain-cards",
        "label": "领域卡"
      }
    },
    {
      "templateId": "敌人",
      "versionRange": {
        "minimumInclusive": "1.0.0",
        "maximumExclusive": "2.0.0"
      },
      "nativeEntry": {
        "id": "adversaries",
        "label": "敌人"
      }
    },
    {
      "templateId": "环境",
      "versionRange": {
        "minimumInclusive": "1.0.0",
        "maximumExclusive": "2.0.0"
      },
      "nativeEntry": {
        "id": "environments",
        "label": "环境"
      }
    }
  ],
  "embeddedResources": [
    {
      "path": "resources/daggerheart-core.pbres"
    }
  ]
}
