{
  "contractVersion": "1.0.0",
  "package": {
    "id": "01a04186-51be-74e1-b94f-ec17d354dc00",
    "version": "1.0.3",
    "name": "寻望之心",
    "description": "由迁移后的 Sheet Runtime 驱动的寻望之心系统包。"
  },
  "runtime": {
    "characterDataVersion": "1.0.0",
    "loadingPresentation": {
      "tagline": "正在感染病毒...",
      "accentColor": "#302e28"
    },
    "pages": "pages.json",
    "skins": [
      {
        "id": "survivor-notebook",
        "name": "求生者手记",
        "css": "skins/survivor-notebook.css",
        "frameworkColorScheme": "light"
      }
    ],
    "defaultSkin": "survivor-notebook",
    "modules": "modules.json",
    "dependencies": "dependencies.json",
    "characterTextExports": "exports/character-text.json",
    "validationChecks": [
      {
        "id": "character-state",
        "script": "checks/character-state.js"
      },
      {
        "id": "character-details",
        "script": "checks/character-details.js"
      },
      {
        "id": "core-hurt",
        "script": "checks/core-hurt.js"
      },
      {
        "id": "inventory",
        "script": "checks/inventory.js"
      }
    ]
  },
  "resourceCompatibility": [
    {
      "templateId": "自由",
      "versionRange": {
        "minimumInclusive": "1.0.0",
        "maximumExclusive": "2.0.0"
      },
      "nativeEntry": {
        "id": "survivor-styles",
        "label": "求生者风格"
      }
    },
    {
      "templateId": "寻望物资",
      "versionRange": {
        "minimumInclusive": "1.0.0",
        "maximumExclusive": "2.0.0"
      },
      "nativeEntry": {
        "id": "supplies",
        "label": "物资"
      }
    }
  ],
  "embeddedResources": [
    {
      "path": "resources/heart-of-hopefind.pbres"
    }
  ]
}
